code,name,network_id,network_region,description,npi_id,latitude,longitude,units
KENNEDY,Kennedy Energy Park,NEM,QLD1,"<p>Kennedy Energy Park is a world-first wind, solar and energy storage facility located in Flinders Shire in central north Queensland. The project is owned by Windlab and Eurus. Construction has commenced and it will be generating by late 2019.</p>",,-20.872792,144.413034,"[{'code': 'KEPWF1', 'fueltech_id': 'wind', 'status_id': 'operating', 'capacity_registered': 43.2, 'capacity_maximum': 43.0, 'capacity_storage': None, 'emissions_factor_co2': None, 'data_first_seen': '2021-07-06T13:20:00+10:00', 'data_last_seen': '2025-12-04T00:00:00+10:00', 'dispatch_type': 'GENERATOR', 'commencement_date': None, 'commencement_date_specificity': None, 'commencement_date_display': None, 'closure_date': None, 'closure_date_specificity': None, 'closure_date_display': None, 'expected_operation_date': None, 'expected_operation_date_specificity': None, 'expected_operation_date_display': None, 'expected_closure_date': None, 'expected_closure_date_specificity': None, 'expected_closure_date_display': None, 'construction_start_date': None, 'construction_start_date_specificity': None, 'construction_start_date_display': None, 'project_approval_date': None, 'project_approval_date_specificity': None, 'project_approval_date_display': None, 'project_lodgement_date': None, 'created_at': '2023-10-18T04:35:01+00:00', 'updated_at': '2025-05-08T05:09:17+00:00'}]"
KIATAWF,Kiata,NEM,VIC1,"<p>Kiata Wind Farm is a small wind farm located along the Western Highway north of Nhill. The wind farm is owned by Windlab, the John Laing Group and some local shareholders. The turbines were built by Keppel Prince and assembled at the site by Windlab. It was &quot;officially opened&quot; by Lily D&#x27;Ambrosio on Australia Day 2018. According to Kiata Wind Farm director Rob Fisher, the Kiata turbines &quot;are the biggest turbines operating in Australia to date.&quot; The ABC reported that some of the local landholders would become part owners &quot;via a community investment model.&quot;</p>",,-36.397693,141.746827,"[{'code': 'KIATAWF1', 'fueltech_id': 'wind', 'status_id': 'operating', 'capacity_registered': 31.0, 'capacity_maximum': 31.0, 'capacity_storage': None, 'emissions_factor_co2': None, 'data_first_seen': '2017-11-10T09:35:00+10:00', 'data_last_seen': '2025-12-03T22:25:00+10:00', 'dispatch_type': 'GENERATOR', 'commencement_date': None, 'commencement_date_specificity': None, 'commencement_date_display': None, 'closure_date': None, 'closure_date_specificity': None, 'closure_date_display': None, 'expected_operation_date': None, 'expected_operation_date_specificity': None, 'expected_operation_date_display': None, 'expected_closure_date': None, 'expected_closure_date_specificity': None, 'expected_closure_date_display': None, 'construction_start_date': None, 'construction_start_date_specificity': None, 'construction_start_date_display': None, 'project_approval_date': None, 'project_approval_date_specificity': None, 'project_approval_date_display': None, 'project_lodgement_date': None, 'created_at': '2023-10-18T04:35:03+00:00', 'updated_at': '2025-05-08T06:02:08+00:00'}]"
LKBONNY1,Lake Bonney,NEM,SA1,"<p>The Lake Bonney Wind Farms are located on the Woakwine Range, about 2 km from the eastern shore of Lake Bonney, near Millicent in South Australia. The wind farm was constructed in three separate stages (Lake Bonney 1, 2 and 3) with the final stage commencing operations in July 2010.</p><p>The 278.5 MW wind farm comprises 112 wind turbines which include 46 Vestas V66 wind turbines and 66 Vestas V90 wind turbines.</p>",,-37.760504,140.405541,"[{'code': 'LKBONNY1', 'fueltech_id': 'wind', 'status_id': 'operating', 'capacity_registered': 80.5, 'capacity_maximum': 81.0, 'capacity_storage': None, 'emissions_factor_co2': None, 'data_first_seen': '2009-07-01T00:05:00+10:00', 'data_last_seen': '2025-12-04T00:00:00+10:00', 'dispatch_type': 'GENERATOR', 'commencement_date': None, 'commencement_date_specificity': None, 'commencement_date_display': None, 'closure_date': None, 'closure_date_specificity': None, 'closure_date_display': None, 'expected_operation_date': None, 'expected_operation_date_specificity': None, 'expected_operation_date_display': None, 'expected_closure_date': None, 'expected_closure_date_specificity': None, 'expected_closure_date_display': None, 'construction_start_date': None, 'construction_start_date_specificity': None, 'construction_start_date_display': None, 'project_approval_date': None, 'project_approval_date_specificity': None, 'project_approval_date_display': None, 'project_lodgement_date': None, 'created_at': '2023-10-18T04:35:04+00:00', 'updated_at': '2025-05-08T06:42:33+00:00'}]"
LKBONNY_2,Lake Bonney 2,NEM,SA1,"<p>The Lake Bonney Wind Farms are located on the Woakwine Range, about 2 km from the eastern shore of Lake Bonney, near Millicent in South Australia. The wind farm was constructed in three separate stages (Lake Bonney 1, 2 and 3) with the final stage commencing operations in July 2010.</p><p>The 278.5 MW wind farm comprises 112 wind turbines which include 46 Vestas V66 wind turbines and 66 Vestas V90 wind turbines.</p>",,-37.760504,140.405541,"[{'code': 'LKBONNY2', 'fueltech_id': 'wind', 'status_id': 'operating', 'capacity_registered': 159.0, 'capacity_maximum': 159.0, 'capacity_storage': None, 'emissions_factor_co2': None, 'data_first_seen': '2007-05-31T17:00:00+10:00', 'data_last_seen': '2025-12-04T00:00:00+10:00', 'dispatch_type': 'GENERATOR', 'commencement_date': None, 'commencement_date_specificity': None, 'commencement_date_display': None, 'closure_date': None, 'closure_date_specificity': None, 'closure_date_display': None, 'expected_operation_date': None, 'expected_operation_date_specificity': None, 'expected_operation_date_display': None, 'expected_closure_date': None, 'expected_closure_date_specificity': None, 'expected_closure_date_display': None, 'construction_start_date': None, 'construction_start_date_specificity': None, 'construction_start_date_display': None, 'project_approval_date': None, 'project_approval_date_specificity': None, 'project_approval_date_display': None, 'project_lodgement_date': None, 'created_at': '2023-10-18T04:35:06+00:00', 'updated_at': '2025-05-08T06:45:37+00:00'}]"
LKBONNY3,Lake Bonney 3,NEM,SA1,"<p>After the successful development of both the Lake Bonney Stage 1 (80.5 MW) and Lake Bonney Stage 2 (159 MW) wind farm projects, Lake Bonney Wind Power, a subsidiary of Infigen energy, successfully commissioned the 39 MW Lake Bonney Stage 3 wind farm. Construction commenced in February 2009 and was commissioned in September 2009.</p>",,-37.760504,140.405541,"[{'code': 'LKBONNY3', 'fueltech_id': 'wind', 'status_id': 'operating', 'capacity_registered': 39.0, 'capacity_maximum': 39.0, 'capacity_storage': None, 'emissions_factor_co2': None, 'data_first_seen': '2010-07-02T15:55:00+10:00', 'data_last_seen': '2025-12-04T00:00:00+10:00', 'dispatch_type': 'GENERATOR', 'commencement_date': None, 'commencement_date_specificity': None, 'commencement_date_display': None, 'closure_date': None, 'closure_date_specificity': None, 'closure_date_display': None, 'expected_operation_date': None, 'expected_operation_date_specificity': None, 'expected_operation_date_display': None, 'expected_closure_date': None, 'expected_closure_date_specificity': None, 'expected_closure_date_display': None, 'construction_start_date': None, 'construction_start_date_specificity': None, 'construction_start_date_display': None, 'project_approval_date': None, 'project_approval_date_specificity': None, 'project_approval_date_display': None, 'project_lodgement_date': None, 'created_at': '2023-10-18T04:35:04+00:00', 'updated_at': '2025-05-08T06:46:21+00:00'}]"
LGAPWF1,Lincoln Gap,NEM,SA1,"<p>The Lincoln Gap Wind Farm is a wind farm under construction in the vicinity of Lincoln Gap on northeastern Eyre Peninsula in South Australia, Australia. It is proposed to consist of 59 wind turbines and generate a total of 212 MW of electricity. Construction began in late 2017 and was initially expected to be commissioned in late 2018. Construction was delayed in July 2018 when unexploded ordnance was discovered on the site, left from historic military testing. The site is not far from the Cultana Training Area.</p>",,-32.546333,137.552763,"[{'code': 'LGAPWF1', 'fueltech_id': 'wind', 'status_id': 'operating', 'capacity_registered': 126.0, 'capacity_maximum': 123.0, 'capacity_storage': None, 'emissions_factor_co2': None, 'data_first_seen': '2019-05-01T11:55:00+10:00', 'data_last_seen': '2025-12-04T00:00:00+10:00', 'dispatch_type': 'GENERATOR', 'commencement_date': None, 'commencement_date_specificity': None, 'commencement_date_display': None, 'closure_date': None, 'closure_date_specificity': None, 'closure_date_display': None, 'expected_operation_date': None, 'expected_operation_date_specificity': None, 'expected_operation_date_display': None, 'expected_closure_date': None, 'expected_closure_date_specificity': None, 'expected_closure_date_display': None, 'construction_start_date': None, 'construction_start_date_specificity': None, 'construction_start_date_display': None, 'project_approval_date': None, 'project_approval_date_specificity': None, 'project_approval_date_display': None, 'project_lodgement_date': None, 'created_at': '2023-10-18T04:35:04+00:00', 'updated_at': '2025-05-08T06:54:26+00:00'}, {'code': 'LGAPWF2', 'fueltech_id': 'wind', 'status_id': 'operating', 'capacity_registered': 86.0, 'capacity_maximum': 85.0, 'capacity_storage': None, 'emissions_factor_co2': None, 'data_first_seen': '2021-12-14T01:05:00+10:00', 'data_last_seen': '2025-12-04T00:00:00+10:00', 'dispatch_type': 'GENERATOR', 'commencement_date': None, 'commencement_date_specificity': None, 'commencement_date_display': None, 'closure_date': None, 'closure_date_specificity': None, 'closure_date_display': None, 'expected_operation_date': None, 'expected_operation_date_specificity': None, 'expected_operation_date_display': None, 'expected_closure_date': None, 'expected_closure_date_specificity': None, 'expected_closure_date_display': None, 'construction_start_date': None, 'construction_start_date_specificity': None, 'construction_start_date_display': None, 'project_approval_date': None, 'project_approval_date_specificity': None, 'project_approval_date_display': None, 'project_lodgement_date': None, 'created_at': '2023-10-18T04:35:04+00:00', 'updated_at': '2025-05-08T06:55:15+00:00'}]"
MACARTH,Macarthur,NEM,VIC1,"<p>The Macarthur Wind Farm is a wind farm located in Macarthur, Victoria, Australia, near Hamilton, 260 km west of Melbourne. It is on a 5,500 ha site which has an installed capacity of 420 megawatts (MW). Based on a capacity factor of around 35%, it is estimated that the long-term average generation will be approximately 1,250 GWh per year. The energy produced annually by a wind farm varies year-to-year, and during FY2015 the farm produced 977.9 GWh.<br/>It is the largest wind farm in the southern hemisphere generating enough power for 220,000 homes and abating 1.7 million tons of greenhouse gases annually, at a capacity factor of 35%. The wind farm comprises 140 Vestas V112-3.0MW wind turbines manufactured in Denmark.The project cost about A$1 billion and was fully operational in January 2013. It was constructed by Vestas and Leighton Contractors. The first turbines were connected to the grid in September 2012. AGL also invested an additional $27m in the substation, which is completely owned by the company.</p>",,-38.043483,142.179081,"[{'code': 'MACARTH1', 'fueltech_id': 'wind', 'status_id': 'operating', 'capacity_registered': 420.0, 'capacity_maximum': 420.0, 'capacity_storage': None, 'emissions_factor_co2': None, 'data_first_seen': '2012-09-27T14:20:00+10:00', 'data_last_seen': '2025-12-04T00:00:00+10:00', 'dispatch_type': 'GENERATOR', 'commencement_date': None, 'commencement_date_specificity': None, 'commencement_date_display': None, 'closure_date': None, 'closure_date_specificity': None, 'closure_date_display': None, 'expected_operation_date': None, 'expected_operation_date_specificity': None, 'expected_operation_date_display': None, 'expected_closure_date': None, 'expected_closure_date_specificity': None, 'expected_closure_date_display': None, 'construction_start_date': None, 'construction_start_date_specificity': None, 'construction_start_date_display': None, 'project_approval_date': None, 'project_approval_date_specificity': None, 'project_approval_date_display': None, 'project_lodgement_date': None, 'created_at': '2023-10-18T04:35:07+00:00', 'updated_at': '2025-05-13T01:27:50+00:00'}]"
MCINTYR,MacIntyre,NEM,QLD1,"<p>With a total investment of AU$1.96 billion, the 1,026MW MacIntyre Wind Farm Precinct will be ACCIONA Energía’s biggest renewable energy facility and one of the largest onshore wind farms in the world. Developed in partnership with CleanCo, the Queensland Government’s newest renewable energy generator, the wind farm is expected to be operational in 2024.</p><p></p><p>The MacIntyre Wind Farm will be constructed on land predominately used for sheep farming. Current farming practices will continue during the construction and operations phases of the wind farm. The site has been selected due to its exposure to consistent winds across this part of the country and provides a suitable resource for the development of a wind farm.</p>",,-28.2163,152.0327,"[{'code': 'MCINTYR1', 'fueltech_id': 'wind', 'status_id': 'operating', 'capacity_registered': 923.0, 'capacity_maximum': 890.0, 'capacity_storage': None, 'emissions_factor_co2': None, 'data_first_seen': '2024-08-28T14:45:00+10:00', 'data_last_seen': '2025-12-04T00:00:00+10:00', 'dispatch_type': 'GENERATOR', 'commencement_date': None, 'commencement_date_specificity': None, 'commencement_date_display': None, 'closure_date': None, 'closure_date_specificity': None, 'closure_date_display': None, 'expected_operation_date': None, 'expected_operation_date_specificity': None, 'expected_operation_date_display': None, 'expected_closure_date': None, 'expected_closure_date_specificity': None, 'expected_closure_date_display': None, 'construction_start_date': None, 'construction_start_date_specificity': None, 'construction_start_date_display': None, 'project_approval_date': None, 'project_approval_date_specificity': None, 'project_approval_date_display': None, 'project_lodgement_date': None, 'created_at': '2024-10-01T04:29:41+00:00', 'updated_at': '2025-05-13T01:30:07+00:00'}]"
MAROOWF1,Maroona,NEM,VIC1,"<p>The construction of Maroona Wind Farm was completed in January 2018. It is a a two-turbine wind farm located on private farm land near the township of Maroona, approximately 18km south west of Ararat in Western Victoria. The wind farm has a capacity of 6.9MW and connects to the existing electricity network in the area. In an average year the wind farm will produce the equivalent energy usage of around 4000 households.</p>",,-37.41875,142.82434,"[{'code': 'MAROOWF1', 'fueltech_id': 'wind', 'status_id': 'operating', 'capacity_registered': 6.8, 'capacity_maximum': 6.0, 'capacity_storage': None, 'emissions_factor_co2': None, 'data_first_seen': None, 'data_last_seen': None, 'dispatch_type': 'GENERATOR', 'commencement_date': None, 'commencement_date_specificity': None, 'commencement_date_display': None, 'closure_date': None, 'closure_date_specificity': None, 'closure_date_display': None, 'expected_operation_date': None, 'expected_operation_date_specificity': None, 'expected_operation_date_display': None, 'expected_closure_date': None, 'expected_closure_date_specificity': None, 'expected_closure_date_display': None, 'construction_start_date': None, 'construction_start_date_specificity': None, 'construction_start_date_display': None, 'project_approval_date': None, 'project_approval_date_specificity': None, 'project_approval_date_display': None, 'project_lodgement_date': None, 'created_at': '2023-10-18T04:35:07+00:00', 'updated_at': '2024-10-24T04:27:59+00:00'}]"
MOORAWF1,Moorabool,NEM,VIC1,<p>The Project consists of 104 wind turbines located approximately 25km south east of Ballarat.</p>,,-37.739433,144.171985,"[{'code': 'MOORAWF1', 'fueltech_id': 'wind', 'status_id': 'operating', 'capacity_registered': 312.0, 'capacity_maximum': 305.0, 'capacity_storage': None, 'emissions_factor_co2': None, 'data_first_seen': '2020-11-19T10:55:00+10:00', 'data_last_seen': '2025-12-04T00:00:00+10:00', 'dispatch_type': 'GENERATOR', 'commencement_date': None, 'commencement_date_specificity': None, 'commencement_date_display': None, 'closure_date': None, 'closure_date_specificity': None, 'closure_date_display': None, 'expected_operation_date': None, 'expected_operation_date_specificity': None, 'expected_operation_date_display': None, 'expected_closure_date': None, 'expected_closure_date_specificity': None, 'expected_closure_date_display': None, 'construction_start_date': None, 'construction_start_date_specificity': None, 'construction_start_date_display': None, 'project_approval_date': None, 'project_approval_date_specificity': None, 'project_approval_date_display': None, 'project_lodgement_date': None, 'created_at': '2023-10-18T04:35:09+00:00', 'updated_at': '2025-05-13T03:17:28+00:00'}]"
MRTLSWF,Mortlake South,NEM,VIC1,"<p>ACCIONA&#x27;s fifth wind farm in Australia, with 157.5 MW of power and battery storage. The wind farm is being constructed on cleared open and level land that is predominantly used for dairy farming.</p>",,-38.147965,142.882246,"[{'code': 'MRTLSWF1', 'fueltech_id': 'wind', 'status_id': 'operating', 'capacity_registered': 157.5, 'capacity_maximum': 153.0, 'capacity_storage': None, 'emissions_factor_co2': None, 'data_first_seen': '2022-10-25T18:45:00+10:00', 'data_last_seen': '2025-12-04T00:00:00+10:00', 'dispatch_type': 'GENERATOR', 'commencement_date': None, 'commencement_date_specificity': None, 'commencement_date_display': None, 'closure_date': None, 'closure_date_specificity': None, 'closure_date_display': None, 'expected_operation_date': None, 'expected_operation_date_specificity': None, 'expected_operation_date_display': None, 'expected_closure_date': None, 'expected_closure_date_specificity': None, 'expected_closure_date_display': None, 'construction_start_date': None, 'construction_start_date_specificity': None, 'construction_start_date_display': None, 'project_approval_date': None, 'project_approval_date_specificity': None, 'project_approval_date_display': None, 'project_lodgement_date': None, 'created_at': '2023-10-18T04:35:10+00:00', 'updated_at': '2025-05-13T03:35:09+00:00'}]"
MLWF,Mortons Lane,NEM,VIC1,"<p>Mortons Lane Wind Farm consists of 13 Goldwind GW82/1500 wind turbines with generating capacity up to 19.5 megawatts. The wind farm generates approximately 63.69 GWh of clean electricity which is enough to power more than 12,738 households in Victoria and reduce up to 68,148 t CO2 annually. In April 2021, Prime Super, a leading Australian superannuation fund, acquired Mortons Lane. Prime Super’s investment in the project will be managed by PATRIZIA.</p><p>The Moyne and Southern Grampians Shires granted planning approval for the proposed Mortons Lane wind farm in June 2007 and the project commenced operations in late 2012 and is expected to operate until 2035, at which point the project may be extended through a repowering or asset life extension. Mortons Lane is proud to support Victoria’s transition to clean energy production.</p>",,-37.833186,142.465288,"[{'code': 'MLWF1', 'fueltech_id': 'wind', 'status_id': 'operating', 'capacity_registered': 19.5, 'capacity_maximum': 20.0, 'capacity_storage': None, 'emissions_factor_co2': None, 'data_first_seen': '2012-11-13T14:50:00+10:00', 'data_last_seen': '2025-12-04T00:00:00+10:00', 'dispatch_type': 'GENERATOR', 'commencement_date': None, 'commencement_date_specificity': None, 'commencement_date_display': None, 'closure_date': None, 'closure_date_specificity': None, 'closure_date_display': None, 'expected_operation_date': None, 'expected_operation_date_specificity': None, 'expected_operation_date_display': None, 'expected_closure_date': None, 'expected_closure_date_specificity': None, 'expected_closure_date_display': None, 'construction_start_date': None, 'construction_start_date_specificity': None, 'construction_start_date_display': None, 'project_approval_date': None, 'project_approval_date_specificity': None, 'project_approval_date_display': None, 'project_lodgement_date': None, 'created_at': '2023-10-18T04:35:09+00:00', 'updated_at': '2025-05-13T03:36:31+00:00'}]"
MEWF,Mt Emerald,NEM,QLD1,"<p>Mount Emerald Wind Farm is a 180 MW wind farm situated on Mount Emerald, in Arriga, Shire of Mareeba, Queensland, Australia. It is approximately 8 km WNW of Tolga, and 49 km SW of Cairns. The project is a joint venture between Port Bajool (land owner) and RATCH-Australia (wind farm developer and operator). RATCH-Australia bought the project from Transfield Services in July 2011. The wind farm incorporates 53 turbines.</p>",,-17.133248,145.380037,"[{'code': 'MEWF1', 'fueltech_id': 'wind', 'status_id': 'operating', 'capacity_registered': 180.0, 'capacity_maximum': 178.0, 'capacity_storage': None, 'emissions_factor_co2': None, 'data_first_seen': '2018-08-20T14:25:00+10:00', 'data_last_seen': '2025-12-04T00:00:00+10:00', 'dispatch_type': 'GENERATOR', 'commencement_date': None, 'commencement_date_specificity': None, 'commencement_date_display': None, 'closure_date': None, 'closure_date_specificity': None, 'closure_date_display': None, 'expected_operation_date': None, 'expected_operation_date_specificity': None, 'expected_operation_date_display': None, 'expected_closure_date': None, 'expected_closure_date_specificity': None, 'expected_closure_date_display': None, 'construction_start_date': None, 'construction_start_date_specificity': None, 'construction_start_date_display': None, 'project_approval_date': None, 'project_approval_date_specificity': None, 'project_approval_date_display': None, 'project_lodgement_date': None, 'created_at': '2023-10-18T04:35:08+00:00', 'updated_at': '2025-05-13T03:42:29+00:00'}]"
MTGELWF,Mt Gellibrand,NEM,VIC1,"<p>ACCIONA Energía&#x27;s fourth wind farm in Australia, fully operational since August 2018. The Mt Gellibrand Wind Farm has a capacity of 132 MW and will produce enough clean energy to power some 90,000 Australian homes.</p>",,-38.257657,143.798651,"[{'code': 'MTGELWF1', 'fueltech_id': 'wind', 'status_id': 'operating', 'capacity_registered': 138.0, 'capacity_maximum': 132.0, 'capacity_storage': None, 'emissions_factor_co2': None, 'data_first_seen': '2018-06-21T16:40:00+10:00', 'data_last_seen': '2025-12-04T00:00:00+10:00', 'dispatch_type': 'GENERATOR', 'commencement_date': None, 'commencement_date_specificity': None, 'commencement_date_display': None, 'closure_date': None, 'closure_date_specificity': None, 'closure_date_display': None, 'expected_operation_date': None, 'expected_operation_date_specificity': None, 'expected_operation_date_display': None, 'expected_closure_date': None, 'expected_closure_date_specificity': None, 'expected_closure_date_display': None, 'construction_start_date': None, 'construction_start_date_specificity': None, 'construction_start_date_display': None, 'project_approval_date': None, 'project_approval_date_specificity': None, 'project_approval_date_display': None, 'project_lodgement_date': None, 'created_at': '2023-10-18T04:35:10+00:00', 'updated_at': '2025-09-09T01:06:52+00:00'}]"
MTMERCER,Mt Mercer,NEM,VIC1,"<p>The Mount Mercer Wind Farm is located at Mount Mercer approximately 30 kilometres south of Ballarat in Western Victoria on 2600ha. The wind farm consists of 64 REpower MM92 wind turbines, giving a total installed capacity of 131 MW.</p>",,-37.847593,143.870183,"[{'code': 'MERCER01', 'fueltech_id': 'wind', 'status_id': 'operating', 'capacity_registered': 131.2, 'capacity_maximum': 131.0, 'capacity_storage': None, 'emissions_factor_co2': None, 'data_first_seen': '2013-11-25T14:15:00+10:00', 'data_last_seen': '2025-12-04T00:00:00+10:00', 'dispatch_type': 'GENERATOR', 'commencement_date': None, 'commencement_date_specificity': None, 'commencement_date_display': None, 'closure_date': None, 'closure_date_specificity': None, 'closure_date_display': None, 'expected_operation_date': None, 'expected_operation_date_specificity': None, 'expected_operation_date_display': None, 'expected_closure_date': None, 'expected_closure_date_specificity': None, 'expected_closure_date_display': None, 'construction_start_date': None, 'construction_start_date_specificity': None, 'construction_start_date_display': None, 'project_approval_date': None, 'project_approval_date_specificity': None, 'project_approval_date_display': None, 'project_lodgement_date': None, 'created_at': '2023-10-18T04:35:10+00:00', 'updated_at': '2025-09-09T01:10:58+00:00'}]"
